{
  "$schema": "./voice-shell.schema.json",
  "meta": {
    "id": "voice-shell-for-claude-code",
    "title": "Voice Shell for Claude Code",
    "version": "0.1.0",
    "status": "draft",
    "spec_date": "2026-09-16",
    "ux_languages": ["ru-RU", "en-US"],
    "primary_ux_language": "ru-RU",
    "license": "see repository LICENSE"
  },

  "concept": {
    "id": "concept",
    "summary": "Hands-free голосовой интерфейс поверх уже работающей Claude Code-сессии.",
    "description": "Пользователь ходит по квартире/улице в наушниках Sony, не смотрит на экран и разговаривает с той же Claude Code-сессией, которая работает на компьютере. Система не является новым агентом и не пытается заменить Claude Code — это транспорт голоса и слой представления.",
    "not_a": [
      "новый агент поверх Claude Code",
      "переписыватель промптов",
      "облачный сервис",
      "пульт с закодированными жестами"
    ],
    "chain": [
      "Человек",
      "голос",
      "Android",
      "LAN / Tailscale",
      "Desktop daemon",
      "существующая Claude Code session",
      "репозиторий / shell / git / tests"
    ],
    "canonical_interaction": [
      { "actor": "user", "text": "Клод." },
      { "actor": "system", "text": "<короткий звук>", "kind": "earcon" },
      { "actor": "user", "text": "Почему билд всё ещё падает?" },
      { "actor": "claude", "text": "Осталась одна ошибка в auth.ts. Я знаю, как исправить. Делать?", "delay_hint": "несколько секунд" },
      { "actor": "user", "text": "Да." },
      { "actor": "claude", "text": "<продолжает работу>", "kind": "action" }
    ]
  },

  "principles": [
    {
      "id": "P1",
      "statement": "Одна универсальная физическая команда: ACTIVATE. Всё остальное определяется речью и контекстом.",
      "rationale": "У Sony слишком мало физических input'ов. Кодирование tap/double-tap/swipe/hold в команды превращает систему в пульт от телевизора. Одна кнопка + речь дают неограниченное число команд."
    },
    {
      "id": "P2",
      "statement": "Кнопка наушников — запасной канал, не основной интерфейс.",
      "rationale": "Целевое распределение: ~90% wake word, ~9% автопродолжение диалога, ~1% нажатия. Тогда недостаток «одна неудобная кнопка» исчезает."
    },
    {
      "id": "P3",
      "statement": "Речь пользователя не переписывается. Вывод Claude — пересказывается.",
      "rationale": "Промежуточные LLM на входе дают испорченный телефон. Полный терминальный вывод в ухо — невыносим."
    },
    {
      "id": "P4",
      "statement": "Состояние сообщается earcon'ами, а не фразами.",
      "rationale": "«Я начал прослушивание» раздражает через пять минут."
    },
    {
      "id": "P5",
      "statement": "Одна долговечная Claude Code-сессия, а не новый процесс на каждый запрос.",
      "rationale": "Контекст работы, история и состояние репозитория должны сохраняться между репликами."
    },
    {
      "id": "P6",
      "statement": "Barge-in обязателен. Прерывание — первоклассная операция, не аварийный режим.",
      "rationale": "Без мгновенного «стоп» голосовой интерфейс воспринимается как звонок в техподдержку."
    },
    {
      "id": "P7",
      "statement": "Роль говорящего определяется по акустике и передаётся Claude, но при низкой уверенности роль = unknown, а не выдумывается.",
      "rationale": "Близкий чужой голос или твой тихий голос сломают классификацию по одной громкости. Честное unknown безопаснее ложного master."
    },
    {
      "id": "P8",
      "statement": "Никакого собственного облака. Прямое соединение телефон↔ПК.",
      "rationale": "Дома — LAN, снаружи — Tailscale/WireGuard. Нулевые инфраструктурные расходы и никакого постоянного аудио в интернете."
    }
  ],

  "architecture": {
    "id": "architecture",
    "components": [
      {
        "id": "android_app",
        "name": "Voice Shell (Android)",
        "runs_on": "phone",
        "responsibilities": [
          "локальное детектирование wake word",
          "захват аудио (телефон/Sony/авто)",
          "VAD и определение конца реплики",
          "акустическая классификация говорящего (master/bystander/unknown/self_echo)",
          "проигрывание earcon'ов и TTS",
          "barge-in: мгновенная остановка TTS",
          "UI выбора input/output устройства и активной сессии",
          "WebSocket-клиент к daemon"
        ],
        "non_responsibilities": [
          "интерпретация смысла команд",
          "переписывание транскрипта",
          "запуск Claude Code"
        ]
      },
      {
        "id": "desktop_daemon",
        "name": "voice-claude-daemon",
        "runs_on": "desktop",
        "responsibilities": [
          "подключение к существующей Claude Code session",
          "отправка пользовательского текста",
          "приём вывода Claude и определение состояния",
          "interrupt",
          "approve / reject подтверждений",
          "voice summarizer (вывод → 1–3 предложения)",
          "стриминг статуса на телефон",
          "STT (основной путь), если телефон отдаёт аудио",
          "реестр сессий/проектов"
        ]
      },
      {
        "id": "claude_session",
        "name": "Claude Code session",
        "runs_on": "desktop",
        "responsibilities": ["вся реальная работа: репозиторий, shell, git, тесты"],
        "owned_by_spec": false
      },
      {
        "id": "sony_headset",
        "name": "Sony headphones",
        "runs_on": "user",
        "responsibilities": ["вывод звука", "опционально — микрофон", "опционально — одна кнопка ACTIVATE"]
      }
    ],
    "transport": {
      "protocol": "WebSocket (JSON messages, опционально бинарные аудио-фреймы)",
      "network_modes": [
        { "id": "lan", "description": "Домашний Wi-Fi, прямое соединение", "discovery": "mDNS/_voiceclaude._tcp + ручной ввод host:port" },
        { "id": "tailscale", "description": "Вне дома: Tailscale/WireGuard, тот же прямой адрес", "discovery": "стабильный tailnet-hostname" }
      ],
      "cloud_backend_required": false,
      "auth": { "scheme": "pre-shared token + TLS (self-signed, pinned)", "pairing": "QR-код с host, port и токеном на экране ПК" }
    },
    "dataflow": [
      { "step": 1, "from": "mic", "to": "android_app", "payload": "PCM 16 kHz mono" },
      { "step": 2, "from": "android_app", "to": "android_app", "payload": "wake detect → VAD → segment + acoustic features" },
      { "step": 3, "from": "android_app", "to": "desktop_daemon", "payload": "audio segment или transcript + speaker_role" },
      { "step": 4, "from": "desktop_daemon", "to": "claude_session", "payload": "system preamble + оригинальный transcript" },
      { "step": 5, "from": "claude_session", "to": "desktop_daemon", "payload": "полный вывод + состояние" },
      { "step": 6, "from": "desktop_daemon", "to": "desktop_daemon", "payload": "voice summarizer → 1–3 предложения" },
      { "step": 7, "from": "desktop_daemon", "to": "android_app", "payload": "voice_summary + state" },
      { "step": 8, "from": "android_app", "to": "output_device", "payload": "TTS" }
    ]
  },

  "activation": {
    "id": "activation",
    "universal_action": {
      "name": "ACTIVATE",
      "description": "Единственное физическое действие. После него всё определяется речью и контекстом.",
      "anti_pattern": "tap = X, double tap = Y, swipe = Z, hold = ещё что-то"
    },
    "methods": [
      {
        "id": "wake_word",
        "priority": "primary",
        "target_share_of_use": 0.9,
        "words": ["клод", "коди", "компьютер"],
        "default_word": "клод",
        "on_device_only": true,
        "no_continuous_upload": true,
        "pipeline": ["wake word", "beep", "запись запроса", "VAD определяет конец речи", "STT", "Claude Code"],
        "role_gate": "wake принимается только если сегмент классифицирован как master (или unknown при отключённой строгой политике)"
      },
      {
        "id": "headset_button",
        "priority": "shortcut",
        "target_share_of_use": 0.01,
        "gesture": "hold",
        "hold_ms": { "min": 300, "max": 500 },
        "hold_to_talk": false,
        "behavior": "hold → beep → кнопку отпустил → говоришь сколько хочешь (конец определяет VAD)",
        "note": "Пользователь не обязан держать кнопку, пока говорит."
      },
      {
        "id": "phone_button",
        "priority": "fallback",
        "surfaces": ["кнопка громкости", "большая кнопка на lock-screen", "notification action", "quick settings tile"]
      },
      {
        "id": "conversation_continuation",
        "priority": "primary",
        "target_share_of_use": 0.09,
        "see": "conversation_window"
      }
    ],
    "stop_is_always_voice": {
      "must_work_without_activation": true,
      "see": "interruptions"
    }
  },

  "audio": {
    "id": "audio",
    "capture": {
      "sample_rate_hz": 16000,
      "channels": 1,
      "format": "pcm_s16le",
      "pre_roll_ms": 500,
      "agc": { "enabled": false, "reason": "автогейн уничтожает абсолютные уровни, на которых строится классификация говорящего", "if_unavoidable": "читать примененный gain и компенсировать его в фичах" },
      "aec": { "enabled": true, "reason": "TTS не должен распознаваться как речь пользователя" },
      "noise_suppression": "mild",
      "vad": { "engine": "silero-vad (on-device)", "endpoint_silence_ms": 450, "min_speech_ms": 300, "max_utterance_ms": 30000 }
    },
    "routing": {
      "input_devices": ["auto", "phone_mic", "sony_mic", "laptop_mic"],
      "output_devices": ["sony", "phone", "laptop"],
      "default_input": "auto",
      "default_output": "sony",
      "sony_mic_required": false,
      "auto_policy": [
        {
          "id": "near_phone",
          "condition": "телефон рядом с пользователем (близкая речь по фичам + телефон не в дальнем кармане/сумке по уровню и DRR)",
          "input": "phone_mic",
          "output": "sony",